[
  {
    "name": "Push-up",
    "primary_muscles": [
      "chest (pectoralis major)"
    ],
    "secondary_muscles": [
      "front delts",
      "triceps"
    ],
    "movement_pattern": "push",
    "equipment": [
      "bodyweight"
    ],
    "environment": [
      "floor"
    ],
    "difficulty": "beginner",
    "force_type": "push",
    "laterality": "bilateral",
    "default_rep_range": "8-15",
    "default_rest_seconds": 60,
    "posture_alignment_tags": [
      "core stability",
      "scapular control",
      "spinal alignment"
    ],
    "corrective_or_performance": "performance",
    "progression_path": [
      "knee push-up",
      "incline push-up",
      "standard push-up",
      "decline push-up",
      "archer push-up",
      "one-arm push-up"
    ],
    "dominant_contraction": "concentric",
    "tempo_suggestion": "2 sec down, 1 sec up",
    "contraindications": [
      "wrist pain",
      "shoulder impingement (acute)"
    ],
    "notes": [
      "keep elbows tucked ~45 degrees",
      "body in straight line from head to heels",
      "don't let hips sag"
    ],
    "media": "TBD"
  },
  {
    "name": "Scapular Push-up",
    "primary_muscles": [
      "serratus anterior"
    ],
    "secondary_muscles": [
      "pectoralis minor"
    ],
    "movement_pattern": "push",
    "equipment": [
      "bodyweight"
    ],
    "environment": [
      "floor"
    ],
    "difficulty": "beginner",
    "force_type": "push",
    "laterality": "bilateral",
    "default_rep_range": "10-15",
    "default_rest_seconds": 45,
    "posture_alignment_tags": [
      "scapular control",
      "core stability"
    ],
    "corrective_or_performance": "corrective",
    "progression_path": [
      "Wall Scapular Push-up",
      "Incline Scapular Push-up",
      "Scapular Push-up",
      "Push-up Plus"
    ],
    "dominant_contraction": "concentric",
    "tempo_suggestion": "1 sec protract, 1 sec pause, 2 sec retract",
    "contraindications": [
      "wrist pain",
      "acute shoulder pain"
    ],
    "notes": [
      "elbows stay locked; only the shoulder blades move",
      "push the floor away to spread the shoulder blades apart",
      "let the chest sink between the shoulder blades without the lower back sagging"
    ],
    "media": "TBD"
  },
  {
    "name": "Half-Kneeling Single-Arm Dumbbell Press",
    "primary_muscles": [
      "front delts (anterior deltoid)",
      "triceps brachii"
    ],
    "secondary_muscles": [
      "lateral deltoid",
      "upper trapezius",
      "serratus anterior"
    ],
    "movement_pattern": "push",
    "equipment": [
      "dumbbell"
    ],
    "environment": [
      "floor"
    ],
    "difficulty": "intermediate",
    "force_type": "push",
    "laterality": "unilateral",
    "default_rep_range": "8-12",
    "default_rest_seconds": 75,
    "posture_alignment_tags": [
      "core stability",
      "spinal alignment",
      "scapular control"
    ],
    "corrective_or_performance": "performance",
    "progression_path": [
      "Half-Kneeling Landmine Press",
      "Seated Dumbbell Shoulder Press",
      "Half-Kneeling Single-Arm Dumbbell Press",
      "Standing Single-Arm Dumbbell Press",
      "Single-Arm Kettlebell Bottoms-Up Press"
    ],
    "dominant_contraction": "concentric",
    "tempo_suggestion": "1 sec up, 2-3 sec down",
    "contraindications": [
      "shoulder impingement (acute)",
      "rotator cuff tear or recent shoulder surgery",
      "limited overhead shoulder mobility (lower back arches to compensate)"
    ],
    "notes": [
      "reps are per side",
      "squeeze the glute of the down knee to keep the ribs stacked over the pelvis",
      "press slightly in front of the head, finishing with the biceps near the ear",
      "don't lean away from the working arm"
    ],
    "media": "TBD"
  },
  {
    "name": "Ring Dip",
    "primary_muscles": [
      "chest (pectoralis major, sternal head)",
      "triceps brachii"
    ],
    "secondary_muscles": [
      "front delts (anterior deltoid)"
    ],
    "movement_pattern": "push",
    "equipment": [
      "bodyweight"
    ],
    "environment": [
      "rings"
    ],
    "difficulty": "advanced",
    "force_type": "push",
    "laterality": "bilateral",
    "default_rep_range": "5-10",
    "default_rest_seconds": 120,
    "posture_alignment_tags": [
      "scapular control",
      "core stability"
    ],
    "corrective_or_performance": "performance",
    "progression_path": [
      "Parallel Bar Support Hold",
      "Band-Assisted Parallel Bar Dip",
      "Parallel Bar Dip",
      "Ring Support Hold",
      "Ring Dip",
      "Weighted Ring Dip"
    ],
    "dominant_contraction": "concentric",
    "tempo_suggestion": "3 sec down, 1 sec up",
    "contraindications": [
      "shoulder impingement or anterior shoulder instability",
      "AC joint pain",
      "elbow tendinopathy",
      "recent shoulder dislocation or labral injury"
    ],
    "notes": [
      "master a steady ring support hold (rings turned out at the top) before attempting reps",
      "lower only until the shoulder is just below the elbow; stop short if the front of the shoulder hurts",
      "keep the rings close to the body and the shoulders pulled down, not shrugged"
    ],
    "media": "TBD"
  },
  {
    "name": "Face Pull",
    "primary_muscles": [
      "rear delts (posterior deltoid)",
      "infraspinatus and teres minor (external rotators)",
      "middle trapezius and rhomboids"
    ],
    "secondary_muscles": [
      "lower trapezius",
      "biceps brachii"
    ],
    "movement_pattern": "pull",
    "equipment": [
      "cable",
      "band"
    ],
    "environment": [],
    "difficulty": "beginner",
    "force_type": "pull",
    "laterality": "bilateral",
    "default_rep_range": "12-20",
    "default_rest_seconds": 45,
    "posture_alignment_tags": [
      "scapular control",
      "thoracic extension"
    ],
    "corrective_or_performance": "corrective",
    "progression_path": [
      "Band Pull-Apart",
      "Band Face Pull",
      "Face Pull",
      "Face Pull with External Rotation Hold"
    ],
    "dominant_contraction": "concentric",
    "tempo_suggestion": "1 sec pull, 2 sec hold, 2 sec return",
    "contraindications": [
      "acute rotator cuff injury",
      "shoulder pain when externally rotating"
    ],
    "notes": [
      "set the anchor at upper-chest to eye height and use a rope or band",
      "pull toward the face, splitting the rope and finishing with knuckles pointing back (external rotation)",
      "keep ribs down; don't lean back to move more weight"
    ],
    "media": "TBD"
  },
  {
    "name": "Single-Arm Dumbbell Row",
    "primary_muscles": [
      "lats (latissimus dorsi)",
      "middle trapezius and rhomboids"
    ],
    "secondary_muscles": [
      "rear delts (posterior deltoid)",
      "biceps brachii",
      "brachialis",
      "teres major"
    ],
    "movement_pattern": "pull",
    "equipment": [
      "dumbbell"
    ],
    "environment": [
      "bench"
    ],
    "difficulty": "beginner",
    "force_type": "pull",
    "laterality": "unilateral",
    "default_rep_range": "8-12",
    "default_rest_seconds": 60,
    "posture_alignment_tags": [
      "spinal alignment",
      "scapular control",
      "core stability"
    ],
    "corrective_or_performance": "performance",
    "progression_path": [
      "Seated Band Row",
      "Chest-Supported Dumbbell Row",
      "Single-Arm Dumbbell Row",
      "Staggered-Stance Single-Arm Dumbbell Row",
      "Single-Arm Dumbbell Row with 3-sec Pause"
    ],
    "dominant_contraction": "concentric",
    "tempo_suggestion": "1 sec up, 1 sec pause, 2 sec down",
    "contraindications": [
      "acute low back pain",
      "acute shoulder or elbow pain"
    ],
    "notes": [
      "reps are per side",
      "brace with a flat back; hand and knee on the bench",
      "drive the elbow toward the hip, not straight up to the ear",
      "avoid twisting the torso to finish the rep"
    ],
    "media": "TBD"
  },
  {
    "name": "Barbell Bent-Over Row",
    "primary_muscles": [
      "lats (latissimus dorsi)",
      "middle trapezius and rhomboids"
    ],
    "secondary_muscles": [
      "rear delts (posterior deltoid)",
      "biceps brachii",
      "brachialis",
      "teres major"
    ],
    "movement_pattern": "pull",
    "equipment": [
      "barbell"
    ],
    "environment": [],
    "difficulty": "intermediate",
    "force_type": "pull",
    "laterality": "bilateral",
    "default_rep_range": "6-10",
    "default_rest_seconds": 120,
    "posture_alignment_tags": [
      "spinal alignment",
      "core stability",
      "scapular control"
    ],
    "corrective_or_performance": "performance",
    "progression_path": [
      "Inverted Row",
      "Chest-Supported Dumbbell Row",
      "Barbell Bent-Over Row",
      "Pendlay Row"
    ],
    "dominant_contraction": "concentric",
    "tempo_suggestion": "1 sec up, 1 sec pause, 2 sec down",
    "contraindications": [
      "low back pain or disc herniation (sustained bent-over position)",
      "poor hip-hinge control",
      "acute shoulder or elbow pain"
    ],
    "notes": [
      "hinge to roughly 30-45 degrees above parallel with a neutral spine",
      "pull the bar to the lower ribs/upper abdomen",
      "torso angle stays fixed; no heaving with the hips"
    ],
    "media": "TBD"
  },
  {
    "name": "Pull-up",
    "primary_muscles": [
      "lats (latissimus dorsi)"
    ],
    "secondary_muscles": [
      "teres major",
      "biceps brachii",
      "brachialis",
      "lower trapezius",
      "rhomboids"
    ],
    "movement_pattern": "pull",
    "equipment": [
      "bodyweight"
    ],
    "environment": [
      "pull-up bar"
    ],
    "difficulty": "intermediate",
    "force_type": "pull",
    "laterality": "bilateral",
    "default_rep_range": "5-10",
    "default_rest_seconds": 120,
    "posture_alignment_tags": [
      "scapular control",
      "core stability"
    ],